results/classwise_model_comparison.csv

<PARSED TEXT FOR SHEET: 1 / 1 TABS
TAB NAME: classwise_model_comparison.csv>index,intent,support,logreg_precision,bert_precision,logreg_recall,bert_recall,logreg_f1,bert_f1,delta_f1_pp
0,recommendation_locations,31,0.9032258064516128,0.7941176470588235,0.9032258064516128,0.8709677419354839,0.9032258064516128,0.8307692307692308,-7.245657568238206
1,transport_traffic,15,0.8333333333333334,0.75,1.0,1.0,0.9090909090909092,0.8571428571428571,-5.1948051948051965
2,transport_taxi,23,1.0,0.8846153846153846,0.9565217391304348,1.0,0.9777777777777776,0.9387755102040816,-3.900226757369607
3,play_radio,72,0.9,0.8805970149253731,0.875,0.8194444444444444,0.8873239436619719,0.8489208633093526,-3.84030803526193
4,iot_hue_lightup,27,0.8846153846153846,0.7428571428571429,0.8518518518518519,0.9629629629629628,0.8679245283018868,0.8387096774193549,-2.921485088253195
5,lists_createoradd,39,0.9166666666666666,0.813953488372093,0.8461538461538461,0.8974358974358975,0.88,0.8536585365853658,-2.634146341463417
6,transport_ticket,35,0.9696969696969696,0.8717948717948718,0.9142857142857144,0.9714285714285714,0.9411764705882352,0.918918918918919,-2.225755166931631
7,iot_cleaning,26,0.9615384615384616,0.925925925925926,0.9615384615384616,0.9615384615384616,0.9615384615384616,0.9433962264150944,-1.8142235123367207
8,social_post,81,0.9714285714285714,0.9090909090909092,0.8395061728395061,0.8641975308641975,0.9006622516556292,0.8860759493670886,-1.4586302288540631
9,email_querycontact,26,0.7307692307692307,0.6,0.7307692307692307,0.9230769230769232,0.7307692307692307,0.7272727272727273,-0.3496503496503433
10,general_quirky,169,0.4444444444444444,0.6666666666666666,0.6627218934911243,0.4378698224852071,0.5320665083135392,0.5285714285714286,-0.3495079742110607
11,iot_hue_lighton,3,0.0,0.0,0.0,0.0,0.0,0.0,0.0
12,music_dislikeness,4,0.0,0.0,0.0,0.0,0.0,0.0,0.0
13,takeaway_order,22,0.9,0.9,0.8181818181818182,0.8181818181818182,0.8571428571428571,0.8571428571428571,0.0
14,audio_volume_other,6,1.0,1.0,0.3333333333333333,0.3333333333333333,0.5,0.5,0.0
15,general_greet,1,0.0,0.0,0.0,0.0,0.0,0.0,0.0
16,cooking_query,0,0.0,0.0,0.0,0.0,0.0,0.0,0.0
17,play_game,35,0.9142857142857144,0.9142857142857144,0.9142857142857144,0.9142857142857144,0.9142857142857144,0.9142857142857144,0.0
18,play_music,176,0.8461538461538461,0.8743169398907104,0.9375,0.9090909090909092,0.889487870619946,0.8913649025069638,0.187703188701771
19,qa_definition,57,0.8727272727272727,0.847457627118644,0.8421052631578947,0.8771929824561403,0.8571428571428571,0.8620689655172413,0.492610837438423
20,email_query,119,0.9469026548672568,0.9905660377358492,0.8991596638655462,0.8823529411764706,0.9224137931034484,0.9333333333333332,1.091954022988506
21,social_query,25,0.8947368421052632,0.7692307692307693,0.68,0.8,0.7727272727272727,0.7843137254901961,1.158645276292336
22,qa_currency,39,0.95,0.9743589743589745,0.9743589743589745,0.9743589743589745,0.9620253164556962,0.9743589743589745,1.2333657903278117
23,play_podcasts,63,0.9444444444444444,0.9152542372881356,0.8095238095238095,0.8571428571428571,0.8717948717948718,0.8852459016393442,1.345102984447244
24,iot_coffee,36,1.0,1.0,0.9444444444444444,0.9722222222222222,0.9714285714285714,0.9859154929577464,1.448692152917508
25,news_query,124,0.875,0.8983050847457628,0.8467741935483871,0.8548387096774194,0.860655737704918,0.8760330578512396,1.537732014632165
26,recommendation_movies,20,0.8235294117647058,0.7083333333333334,0.7,0.85,0.7567567567567568,0.7727272727272727,1.5970515970515908
27,calendar_set,209,0.8634361233480177,0.9182692307692308,0.937799043062201,0.9138755980861244,0.8990825688073395,0.9160671462829736,1.6984577475634088
28,email_sendemail,114,0.913793103448276,0.923728813559322,0.9298245614035088,0.956140350877193,0.9217391304347826,0.9396551724137931,1.7916041979010533
29,audio_volume_down,11,0.8,0.75,0.7272727272727273,0.8181818181818182,0.7619047619047619,0.782608695652174,2.0703933747412084
30,weather_query,156,0.9096774193548388,0.91875,0.903846153846154,0.9423076923076924,0.9067524115755627,0.930379746835443,2.3627335259880256
31,transport_query,51,0.8478260869565217,0.8541666666666666,0.7647058823529411,0.803921568627451,0.8041237113402062,0.8282828282828283,2.415911694262207
32,qa_stock,26,0.8846153846153846,0.8387096774193549,0.8846153846153846,1.0,0.8846153846153846,0.912280701754386,2.7665317139001333
33,calendar_remove,67,0.8611111111111112,0.8888888888888888,0.9253731343283582,0.9552238805970148,0.8920863309352518,0.920863309352518,2.877697841726623
34,recommendation_events,43,0.775,0.8205128205128205,0.7209302325581395,0.7441860465116279,0.7469879518072289,0.7804878048780488,3.349985307081993
35,iot_wemo_off,18,0.8571428571428571,0.8666666666666667,0.6666666666666666,0.7222222222222222,0.75,0.7878787878787878,3.787878787878785
36,audio_volume_mute,32,0.7941176470588235,0.7894736842105263,0.84375,0.9375,0.8181818181818182,0.8571428571428571,3.8961038961038863
37,takeaway_query,35,0.9615384615384616,0.9333333333333332,0.7142857142857143,0.8,0.819672131147541,0.8615384615384616,4.186633039092058
38,datetime_query,88,0.8809523809523809,0.9866666666666668,0.8409090909090909,0.8409090909090909,0.8604651162790697,0.9079754601226994,4.751034384362962
39,qa_maths,25,1.0,0.7857142857142857,0.64,0.88,0.7804878048780488,0.8301886792452831,4.970087436723425
40,audio_volume_up,13,0.5833333333333334,0.6153846153846154,0.5384615384615384,0.6153846153846154,0.56,0.6153846153846154,5.5384615384615365
41,cooking_recipe,72,0.9322033898305084,0.9014084507042254,0.7638888888888888,0.8888888888888888,0.8396946564885496,0.8951048951048951,5.541023861634553
42,play_audiobook,41,0.8823529411764706,0.9166666666666666,0.7317073170731707,0.8048780487804879,0.8,0.8571428571428571,5.714285714285705
43,email_addcontact,12,0.6363636363636364,0.6,0.5833333333333334,0.75,0.6086956521739131,0.6666666666666666,5.797101449275354
44,alarm_set,41,0.8409090909090909,0.9069767441860463,0.902439024390244,0.951219512195122,0.8705882352941177,0.9285714285714286,5.798319327731094
45,iot_hue_lightoff,43,0.8636363636363636,0.9111111111111112,0.8837209302325582,0.9534883720930232,0.8735632183908046,0.9318181818181818,5.825496342737713
46,qa_factoid,141,0.6445783132530121,0.7354838709677419,0.7588652482269503,0.8085106382978723,0.6970684039087948,0.7702702702702703,7.320186636147552
47,general_joke,19,1.0,0.9,0.7368421052631579,0.9473684210526316,0.8484848484848485,0.9230769230769232,7.459207459207462
48,calendar_query,126,0.6558441558441559,0.7098765432098766,0.8015873015873016,0.9126984126984128,0.7214285714285714,0.7986111111111112,7.718253968253974
49,alarm_query,34,0.9333333333333332,0.9428571428571428,0.8235294117647058,0.9705882352941176,0.875,0.9565217391304348,8.15217391304348
50,iot_hue_lightchange,36,0.7631578947368421,0.9090909090909092,0.8055555555555556,0.8333333333333334,0.7837837837837838,0.8695652173913043,8.578143360752055
51,lists_query,51,0.78,0.9523809523809524,0.7647058823529411,0.7843137254901961,0.7722772277227723,0.8602150537634409,8.793782604066857
52,iot_hue_lightdim,21,0.9411764705882352,0.9090909090909092,0.7619047619047619,0.9523809523809524,0.8421052631578947,0.9302325581395348,8.812729498164018
53,music_query,35,0.896551724137931,0.8888888888888888,0.7428571428571429,0.9142857142857144,0.8125,0.9014084507042254,8.890845070422538
54,lists_remove,52,0.95,0.94,0.7307692307692307,0.903846153846154,0.8260869565217391,0.9215686274509804,9.54816709292412
55,iot_wemo_on,10,0.75,0.875,0.6,0.7,0.6666666666666666,0.7777777777777778,11.111111111111116
56,music_settings,6,1.0,0.3333333333333333,0.1666666666666666,0.5,0.2857142857142857,0.4,11.428571428571432
57,music_likeness,36,0.9090909090909092,0.7948717948717948,0.5555555555555556,0.8611111111111112,0.6896551724137931,0.8266666666666667,13.701149425287351
58,alarm_remove,21,1.0,1.0,0.7142857142857143,1.0,0.8333333333333334,1.0,16.666666666666664
59,datetime_convert,15,0.8333333333333334,0.5789473684210527,0.3333333333333333,0.7333333333333333,0.4761904761904761,0.6470588235294118,17.086834733893564

README.md

### Class-wise trade-offs

The aggregate improvement does not mean BERT improves every intent. For example, on `general_quirky`, BERT has higher Precision (66.67% vs. 44.44%) but lower Recall (43.79% vs. 66.27%), with similar F1 (52.86% vs. 53.21%). The complete 60-label comparison is in [`results/classwise_model_comparison.csv`](results/classwise_model_comparison.csv).